Frame,Latitude,Longitude,Location,Defects,Defect Count
frame_00407.jpg,19.112426,74.728839,"Ahmadnagar, Maharashtra, India, «| 2, Balikashram Rd, Suman Colony, Mahavir Nagar,, ee Ahmadnagar, Maharashtra 414003, India, sab Lat 19.112426° Long 74.728839°",None,0
frame_00408.jpg,19.112544,74.728792,"Ahmadnagar, Maharashtra, India, 2, Balikashram Rd, Suman Colony, Mahavir Nagar,, Ahmadnagar, Maharashtra 414003, India",cracks: 1,1
frame_00409.jpg,19.112544,74.728792,"Ahmadnagar, Maharashtra, India, 2, Balikashram Rd, Suman Colony, Mahavir Nagar,, Ahmadnagar, Maharashtra 414003, India, Se we aes” Lat 19.112544° Long 74.728792°, E Jat GW = ,",cracks: 1,1
frame_00410.jpg,19.112666,74.728745,"Hedeate, Maharashtra, India, 2, Balikashram Rd, Suman Colony, Mahavir Nagar,, serqaai, Maharashtra 414003, India",cracks: 2,2
frame_00411.jpg,19.113308,74.728516,"Ahmadnagar, MaharasnNtra, India, 01, Bhutkarwadi Rd, Mahavir Nagar, Ahmadnagar,, Maharashtra 414001, India",cracks: 1,1
frame_00412.jpg,19.113308,74.728516,"Ahmadnagar, Maharashtra, India =, 01, Bhutkarwadi Rd, Mahavir Nagar, Anhmadnagar, (eee, Maharashtra 414001, India","cracks: 1, manhole: 1",2
frame_00413.jpg,19.113736,74.728369,"Ahmadnagar, Maharashtra, India, Bhutakarvadi, Balikashram Rd, Mahavir Nagar,, Ahmadnagar, Maharashtra 414003, India",cracks: 1,1
frame_00414.jpg,19.113736,74.728369,"Ahmadnagar, Maharashtra, India, Bhutakarvadi, Balikashram Rd, Mahavir Nagar,, Ahmadnagar, Maharashtra 414003, India, Ser oat |",None,0
frame_00415.jpg,19.113856,74.728327,"paleiaey, Ahmadnagar, Maharashtra, India, 279/10, Balikashram Rd, Bhutkarwadi, Borude Mala,, Ahmadnagar, Maharashtra 414001, India",cracks: 1,1
frame_00416.jpg,19.114388,74.728148,"Hedeatz, Maharashtra, India, Shop No. 3, Opp Laxmi Garden, Balikaashram Rasen, Road,ahmednagar,madhya Pradesh, Mahavir Nagar, Sede"", See, Maharashtra 414003, India S",cracks: 1,1
frame_00417.jpg,19.114512,74.728113,"Ahmadnagar, Maharashtra, India, 16, Balikashram Rd, Borude Mala, Anmadnagar,, A Maharashtra 414001, India, Ja | Lat 19.114512° Long 74.728113°, ea ¥",cracks: 1,1
frame_00418.jpg,19.114512,74.728113,"Ahmadnagar, MaharasnNtra, India ©, 16, Balikashram Rd, Borude Mala, Ahmadnagar,, Maharashtra 414001, India",cracks: 3,3
frame_00419.jpg,19.114645,74.728073,"mh ye, pe., Ahmadnagar, MaharasNtra, India, Bhutkarwadi, Balikashram Road, Bhutkarwadi Rd, Near, Mahalaxmi Garden, Borude Mala, Ahmadnagar, Maharashtra, 414003, India",None,0
frame_00420.jpg,19.114906,74.727997,"a ae, ha. x, Y ¢. Se, y . ee 2, Ahmadnagar, Maharashtra, India ===, =. 6 ¥ 2 <a 10, Balikashram Rd, Audumbar Colony, Borude Mala, | es =, , ha) ree A@ 3 Ahmadnagar, Maharashtra 414003, India SSE, ei hie Fy a — 23",cracks: 1,1
frame_00421.jpg,19.115035,74.727965,"hmadnagar, Maharashtra, India Be, 10, Balikashram Rd, Audumbar Colony, Borude Mala, Bassas, Ahmadnagar, Maharashtra 414003, India Sun",None,0
frame_00422.jpg,19.115289,74.727885,"Audumbar Colony, 10, Balikashram Rd, Borude Mala,, Ahmadnagar, Maharashtra 414003, India",cracks: 2,2
frame_00423.jpg,19.115289,74.727885,"Goo, ie Pot Ore, ee ot eh eee, * Ahmadnagar, Maharashtra, India Ga=, Audumbar Colony, 10, Balikashram Rd, Borude Mala, Bae, Ahmadnagar, Maharashtra 414003, India 5S :",cracks: 1,1
frame_00424.jpg,19.115289,74.727885,"Whit TTT, Peet T yt, Li pe, Ahmadnagar, Maharashtra, India, Audumbar Colony, 10, Balikashram Rd, Borude Mala, & :, Ahmadnagar, Maharashtra 414003, India =",None,0
frame_00425.jpg,19.115408,74.727843,"<3 crs Pe |, “== Ahmadnagar, Maharashtra, India, 38 4p8h+459, Balikashram Rd, Near Nucleus Hospital,, Savedi, Anmadnagar, Maharashtra 414001, India",cracks: 1,1
frame_00426.jpg,19.116029,74.727589,"Ahmadnagar, MaharasnNtra, India, 4p8h+g3c, Balikashram Rd, Mahavir Nagar,, Ahmadnagar, Maharashtra 414001, India",cracks: 1,1
frame_00427.jpg,19.116416,74.727428,"aan Aes), on A \ +, Ahmadnagar, Maharashtra, India, 13, Balikashram Rd, Mahavir Nagar, Anmadnagar,, Maharashtra 414003, India",cracks: 2,2
frame_00428.jpg,19.116542,74.727388,"5, Balikashram Rd, Sai Colony, Borude Mala,, Ahmadnagar, Maharashtra 414001, India",cracks: 1,1
frame_00429.jpg,19.116542,74.727388,"ss >, esses Her, iN be) need, Ahmadnagar, Maharashtra, India, 5, Balikashram Rd, Sai Colony, Borude Mala,, Ahmadnagar, Maharashtra 414001, India",cracks: 1,1
frame_00430.jpg,19.116542,74.727388,"Ahmadnagar, Maharashtra, India, 5, Balikashram Rd, Sai Colony, Borude Mala,, Ahmadnagar, Maharashtra 414001, India, A Lat 19.116542° Long 74.727388°",None,0
frame_00431.jpg,19.116542,74.727388,"Ahmadnagar, Maharashtra, India |, 5, Balikashram Rd, Sai Colony, Borude Mala,, s Ahmadnagar, Maharashtra 414001, India",None,0
frame_00432.jpg,19.116661,74.727359,"Ahmadnagar, Maharashtra, India, 5, Balikashram Rd, Sai Colony, Borude Mala,, Ahmadnagar, Maharashtra 414001, India",None,0
frame_00433.jpg,19.104413,74.730674,"Ahmadnagar, Maharashtra, India, 4p3j+q6h, Sudke Mala, Ahmadnagar, Maharashtra, 414001, India",None,0
frame_00434.jpg,19.104413,74.730674,"Ahmadnagar, Maharashtra, India, 4p3j+q6h, Sudke Mala, Anmadnagar, Maharashtra, 414001, India",None,0
frame_00435.jpg,19.104413,74.730674,"Ahmadnagar, Maharashtra, India, 4p3j+q6h, Sudke Mala, Anmadnagar, Maharashtra, 414001, India",None,0
frame_00436.jpg,19.104648,74.73059,"+ Ahmadnagar, Maharashtra, India, 1/1, Balikashram Rd, Bagade Mala, Ahmadnagar,, Maharashtra 414001, India",cracks: 1,1
frame_00437.jpg,19.104648,74.73059,"ae See, _ Pa - oe 3B ‘sa), ng), J 7 bath “a a, Ahmadnagar, Maharashtra, India, 1/1, Balikashram Rd, Bagade Mala, Ahmadnagar,, Maharashtra 414001, India",cracks: 2,2
frame_00438.jpg,19.104648,74.73059,"Ahmadnagar, Maharashtra, India, 1/1, Balikashram Rd, Bagade Mala, Ahmadnagar,, Maharashtra 414001, India",cracks: 1,1
frame_00439.jpg,19.104648,74.73059,"Aaah Py eres, = we tara, = eet Ahmadnagar, Maharashtra, India, ee Sigs eg 1/1, Balikashram Rd, Bagade Mala, Ahmadnagar,, Festa 55 Maharashtra 414001, India, a) ) Lat 19.104648° Long 74.73059°, ei Ss fe a e 7",cracks: 1,1
frame_00440.jpg,19.104648,74.73059,"“Go, 3 ona? ats, St Ahmadnagar, MaharasNtra, India, VRE, Be eT eee » 1/1, Balikashram Rd, Bagade Mala, Ahmadnagar,, 5 ratte, 5-988. 7"" Maharashtra 414001, India, eartt Leet, sein, ogl, he 2s gle. ry a",cracks: 1,1
frame_00441.jpg,19.104648,74.73059,"aa | as se ee., ceo, Ahmadnagar, Maharashtra, India, 1/1, Balikashram Rd, Bagade Mala, Ahmadnagar,, Maharashtra 414001, India",cracks: 1,1
frame_00442.jpg,19.104648,74.73059,"= al Ahmadnagar, MaharasnNtra, India §, d Ff siee ~ 1/1, Balikashram Rd, Bagade Mala, Ahmadnagar,, “ai 1s _ Maharashtra 414001, India, ~~ CSaqis Y Lat 19.104648° Long 74.73059°, Gee Pk gle... Rr",cracks: 1,1
frame_00443.jpg,19.104648,74.73059,"Ahmadnagar, Maharashtra, India, : ra bans 1/1, Balikashram Rd, Bagade Mala, Ahmadnagar,, Bes a = _ Maharashtra 414001, India, Zse z gles. Sel i",None,0
frame_00444.jpg,19.104648,74.73059,"Sa Ahmadnagar, Maharashtra, India, )~ 1/1, Balikashram Rd, Bagade Mala, Ahmadnagar,, alge at Maharashtra 414001, India, ""y Lat 19.104648° Long 74.73059°, ""er edt rl b",None,0
frame_00445.jpg,19.104648,74.73059,"~+ Ahmadnagar, Maharashtra, India, 3 Sen its =, . ~ SEEN e ae a oo ag Saleh PO —— : 5, A ~ mA 7 . ee its dane Gnand . ey . -, See §gBSSSS TAPE TT poke : eC : Ee, oS - » Ys MAY ab TS oe, te eas = oe FOO 2, a Re,, 1/1, Balikashram Rd, Bagade Mala, Ahmadnagar,, Maharashtra 414001, India",cracks: 1,1
frame_00446.jpg,19.104648,74.73059,"TINNTI|, Sane, | Sy st, Ahmadnagar, Maharashtra, India, 1/1, Balikashram Rd, Bagade Mala, Ahmadnagar,, Maharashtra 414001, India",None,0
frame_00447.jpg,19.104648,74.73059,"Bim, Soa, 6. MES Fit,, Ahmadnagar, Maharashtra, India, 1/1, Balikashram Rd, Bagade Mala, Ahmadnagar,, Maharashtra 414001, India",None,0
frame_00448.jpg,19.104767,74.730553,"Ahmadnagar, Maharashtra, India, 1/1, Balikashram Rd, Bagade Mala, Ahmadnagar,, Maharashtra 414001, India, & OES",cracks: 1,1
frame_00449.jpg,19.104767,74.730553,"Ahmadnagar, Maharashtra, India, 1/1, Balikashram Rd, Bagade Mala, Ahmadnagar,, Maharashtra 414001, India",None,0
