Frame,Latitude,Longitude,Location,Defects,Defect Count
frame_00140.jpg,19.099328,74.738971,"RA Ahmadnagar, Maharashtra, India =, 5 Maharashtra 414001, India, - Lat 19.099328° Long 74.738971°, ie x oe",pothole: 2,2
frame_00141.jpg,19.099249,74.738967,"Hedqeag, Maharashtra, India, 6122, Sarjepura Rd, Sarjepura City, Hea,, Maharashtra 414001, India",pothole: 2,2
frame_00142.jpg,19.099249,74.738967,"ede, Maharashtra, India, 6122, Sarjepura Rd, Sarjepura City, Hecate,, Maharashtra 414001, India",None,0
frame_00143.jpg,19.09919,74.738959,"Ahmadnagar, Maharashtra, India, No.6150, Sarjepura Rd, Bagadpatti, Sarjepura City,, Ahmadnagar, Maharashtra 414001, India",None,0
frame_00144.jpg,19.09919,74.738959,"Ahmadnagar, Maharashtra, India &, No.6150, Sarjepura Rd, Bagadpatti, Sarjepura City,, Ahmadnagar, Maharashtra 414001, India, Nc a, oe .",pothole: 1,1
frame_00145.jpg,19.099147,74.738949,"Ahmadnagar, Maharashtra, India, 3pxq+jgq, Bagadpatti, Tarakpur, Ahmadnagar,, Maharashtra 414001, India",pothole: 1,1
frame_00146.jpg,19.099147,74.738949,"Ahmadnagar, MaharasnNtra, India ,, 3pxq+jgq, Bagadpatti, Tarakpur, Ahmadnagar, ‘, Maharashtra 414001, India",pothole: 1,1
frame_00147.jpg,19.099099,74.738939,"Heder, Maharashtra, India, Shop No 3 Priyadarshini Complex, Sarjepura Rd, Opp. Saideep :, Bakery, Tarakpur, HeaqaR, Maharashtra 414001, India",pothole: 3,3
frame_00148.jpg,19.09905,74.738938,"Ahmadnagar, Maharashtra, India, Shop No, 6460, Sarjepura Rd, Beside Karachiwala Bakers,, Sarjepura City, Anmadnagar, Maharashtra 414001, India",pothole: 4,4
frame_00149.jpg,19.09905,74.738938,"Ahmadnagar, Maharashtra, India, Shop No, 6460, Sarjepura Rd, Beside Karachiwala Bakers,, Sarjepura City, Anmadnagar, Maharashtra 414001, India 7",pothole: 2,2
frame_00150.jpg,19.09905,74.738938,"Ahmadnagar, Maharashtra, India, Shop No, 6460, Sarjepura Rd, Beside Karachiwala Bakers, &, Sarjepura City, Anmadnagar, Maharashtra 414001, India",None,0
frame_00151.jpg,19.099012,74.738944,"Ahmadnagar, Maharashtra, India, Shop No, 6460, Sarjepura Rd, Beside Karachiwala Bakers, I, Sarjepura City, Anmadnagar, Maharashtra 414001, India, Ambuja, Cement",pothole: 1,1
frame_00152.jpg,19.098972,74.738942,"NSIC ABT, TSH etdra au wO, ys » Anmadnagar, Maharashtra, India ,, | Shop No, 6460, Sarjepura Rd, Beside Karachiwala Bakers, ff, * Sarjepura City, Anmadnagar, Maharashtra 414001, India",None,0
frame_00153.jpg,19.098972,74.738942,"' Wd He, | Ahmadnagar, Maharashtra, India, le ze Shop No, 6460, Sarjepura Rd, Beside Karachiwala Bakers,, aba “= Sarjepura City, Anmadnagar, Maharashtra 414001, India, @ Lat 19.098972° Long 74.738942°",None,0
frame_00154.jpg,19.098938,74.738941,"Ss -=2), Ahmadnagar, Maharashtra, India, Shop No, 6460, Sarjepura Rd, Beside Karachiwala Bakers,, Sarjepura City, Anmadnagar, Maharashtra 414001, India",pothole: 3,3
frame_00155.jpg,19.098938,74.738941,"Ahmadnagar, Maharashtra, India SS, Shop No, 6460, Sarjepura Rd, Beside Karachiwala Bakers, }, Sarjepura City, Anmadnagar, Maharashtra 414001, India, | Lat 19.098938° Long 74.738941°",None,0
frame_00156.jpg,19.098938,74.738941,"a Ao Cth yf, ipo \""f, art tte \, Ahmadnagar, Maharashtra, India Sa, Shop No, 6460, Sarjepura Rd, Beside Karachiwala Bakers, [ess, Sarjepura City, Anmadnagar, Maharashtra 414001, India_",pothole: 1,1
frame_00157.jpg,Not found,Not found,"Ahmadnagar, Maharashtra, India, 1259,juna Dane Dabara, Sarjepura City,, Ahmadnagar, Maharashtra 414001, India",manhole: 1,1
frame_00158.jpg,19.098856,74.738925,"er), a ay SES, POTENT NACHT a, Ahmadnagar, Maharashtra, India, 1259,juna Dane Dabara, Sarjepura City,, Ahmadnagar, Maharashtra 414001, India",pothole: 2,2
frame_00159.jpg,19.098856,74.738925,"PROATENTNONAT ATE, 3. go |, mnow |, wm |, Ahmadnagar, MaharasnNtra, India, 1259,juna Dane Dabara, Sarjepura City,, Ahmadnagar, Maharashtra 414001, India",pothole: 7,7
frame_00160.jpg,19.098808,74.738918,"1259,juna Dane Dabara, Sarjepura City,, Ahmadnagar, Maharashtra 414001, India",pothole: 6,6
frame_00161.jpg,19.098808,74.738918,"_— CN, Xf ‘, Ahmadnagar, Maharashtra, India |, 1259,juna Dane Dabara, Sarjepura City,, Ahmadnagar, Maharashtra 414001, India",pothole: 7,7
frame_00162.jpg,19.098754,74.738922,"Ahmadnagar, Maharashtra, India =~, 3pxq+fhg, Sarjepura Rd, Sarjepura City, SS, Ahmadnagar, Maharashtra 414001, India",pothole: 4,4
frame_00163.jpg,19.098754,74.738922,"Ahmadnagar, Maharashtra, India, 3pxq+fhg, Sarjepura Rd, Sarjepura City,, Ahmadnagar, Maharashtra 414001, India",pothole: 2,2
frame_00164.jpg,19.098704,74.738933,"Ahmadnagar, Maharashtra, India, 3pxq+fhg, Sarjepura Rd, Sarjepura City,, Ahmadnagar, Maharashtra 414001, India",pothole: 2,2
frame_00165.jpg,19.098704,74.738933,"> ee a, Ahmadnagar, Maharashtra, India, 3pxq+fhg, Sarjepura Rd, Sarjepura City,, Ahmadnagar, Maharashtra 414001, India",pothole: 1,1
frame_00166.jpg,19.09847,74.738904,"Peet itp des,, Ahmadnagar, Maharashtra, India 2, 3pxq+9h8, Sarjepura Rd, Sarjepura City,, Ahmadnagar, Maharashtra 414001, India",cracks: 1,1
frame_00167.jpg,19.09847,74.738904,"“a Ahmadnagar, Maharashtra, India, 3pxq+Q9h8, Sarjepura Rd, Sarjepura City, oe ee, & Ahmadnagar, Maharashtra 414001, India >, ~ Lat 19.09847° Long 74.738904°",None,0
frame_00168.jpg,19.098425,74.738906,"Shantadurga Apartment Shop No 10, Area, ‘Cts No 912,, Sarjepura Rd, Sarjepura City, Ahmadnagar, Maharashtra, 414001, India",None,0
frame_00169.jpg,Not found,Not found,"Ahmadnagar, Maharashtra, India, Shantadurga Apartment Shop No 10, Area, Cts No 912,, Sarjepura Rd, Sarjepura City, Anmadnagar, Maharashtra, 414001, India, Lat 19. 0984209 axe 74. pada",None,0
frame_00170.jpg,19.098376,74.738907,"Ahmadnagar, Maharashtra, India, Shantadurga Apartment Shop No 10, Area, Cts No 912,, Sarjepura Rd, Sarjepura City, Anmadnagar, Maharashtra, 414001, India",cracks: 1,1
frame_00171.jpg,19.098376,74.738907,"Ahmadnagar, Maharashtra, India, Shantadurga Apartment Shop No 10, Area, Cts No 912,, Sarjepura Rd, Sarjepura City, Anmadnagar, Maharashtra, 414001, India",None,0
frame_00172.jpg,19.09831,74.738911,"Ahmadnagar, Maharashtra, India, *— Shop No 01, Parnayaik Galli, Teli Knhunt Rd, Opp. Latur Bank,, - Sarjepura City, Ahmadnagar, Maharashtra 414001, India","manhole: 2, pothole: 1",3
frame_00173.jpg,19.09831,74.738911,"Ahmadnagar, Maharashtra, India, Shop No 01, Parnayaik Galli, Teli Knunt Rd, Opp. Latur Bank,, Sarjepura City, Anmadnagar, Maharashtra 414001, India",None,0
frame_00174.jpg,19.098232,74.738927,"ate, sHedqeate, Maharashtra, India, 3pxq+7hf, Dal Mandai Rd, Sarjepura City, Heaaate,, Maharashtra 414001, India, we a. a",None,0
frame_00175.jpg,19.098162,74.738937,"i / 4 . 4, ye,, Ahmadnagar, Maharashtra, Tatelr:', 3pxq+7hf, Dal Mandai Rd, Sarjepura City,, Ahmadnagar, Maharashtra 414001, India",None,0
frame_00176.jpg,19.098162,74.738937,"aay, vera, Ahmadnagar, Maharashtra, India ms, 3pxq+7hf, Dal Mandai Rd, Sarjepura City, *, Ahmadnagar, Maharashtra 414001, India, “= = Se ert",None,0
frame_00177.jpg,19.098162,74.738937,"Ahmadnagar, Maharashtra,, 3pxq+7hf, Dal Mandai Rd, Sarjepura City,, Ahmadnagar, Maharashtra 414001, India",None,0
frame_00178.jpg,19.098115,74.738942,"s~ ANmadnagar, Maharashtra, India, Wahi Height (i Floor), Lal Taki, Next To Hdfc Bank Near Amar, Hotel, 3pxq+7h8, Sarjepura Rd, Sarjepura City, Ahmadnagar,, Maharashtra 414001, India, ryt 4",None,0
frame_00179.jpg,19.098115,74.738942,"Ahmadnagar, Maharashtra, India, Wahi Height (i Floor), Lal Taki, Next To Hdfc Bank Near Amar, Hotel, 3pxq+7h8, Sarjepura Rd, Sarjepura City, Anmadnagar,, Maharashtra 414001, India, mae one nt ne LOE!","cracks: 2, pothole: 1",3
frame_00180.jpg,19.098063,74.738948,"Ahmadnagar, Maharashtra, India, 996, Sarjepura City, Anmadnagar, Maharashtra, 414001, India",None,0
frame_00181.jpg,19.098015,74.73895,"ti = {, \lsaranie =< pat, 1 Vy vi ty | H —, 13 pad CRAFT t 4 oa, rane 3 fy <, Ahmadnagar, Maharashtra, India f=, 996, Sarjepura City, Anmadnagar, Maharashtra +, 414001, India",cracks: 4,4
frame_00182.jpg,19.098015,74.73895,"996, Sarjepura City, Anmadnagar, Maharashtra, 414001, India, are",cracks: 1,1
frame_00183.jpg,19.097968,74.738953,"“| Ahmadnagar, Maharashtra, India fie =, 996, Sarjepura City, Anmadnagar, Maharashtra, 414001, India, $45 si Lat 19.097968° Long 74.738953°, see, nocd a To, A EPS, SA0Rs",cracks: 1,1
frame_00184.jpg,19.097968,74.738953,"7S ob, aie 996, Sarjepura City, Anmadnagar, Maharashtra, 414001, India, 2 s, iy iw - } Y 2",None,0
frame_00185.jpg,19.097924,74.738958,"Ahmadnagar, MaharasnNtra, India, Shop No 01 Mg Road, Teli Khunt Rd, Sarjepura City,, Ahmadnagar, Maharashtra 414001, India",pothole: 1,1
frame_00186.jpg,19.097924,74.738958,"Ahmadnagar, Maharashtra, India =~, Shop No 01 Mg Road, Teli Khunt Rd, Sarjepura City, ES, Ahmadnagar, Maharashtra 414001, India, eS nD 8 5 RS",None,0
frame_00187.jpg,19.097874,74.73896,"Ahmadnagar, Maharashtra, India ==, Shop No 01 Mg Road, Teli Khunt Rd, Sarjepura City,, Ahmadnagar, Maharashtra 414001, India, . FF x a “78 on Mee yy Ap, ‘ . ha > 3 es .4 . a EO, oe Soe 4 » . . ?",pothole: 3,3
frame_00188.jpg,19.097874,74.73896,"PrePep erst, qagvesa92230, wy Ad, 4 e, WS>=.27 Ahmadnagar, Maharashtra, India fe, . Abas. i Shop No 01 Mg Road, Teli Khunt Rd, Sarjepura City, #eetae, & tz, Ahmadnagar, Maharashtra 414001, India",pothole: 1,1
frame_00189.jpg,19.097807,74.738961,"SKN, , ie 74 ., Ahmadnagar, Maharashtra, India #, — Shop No 01 Mg Road, Teli Khunt Rd, Sarjepura City, ., viv | Ahmadnagar, Maharashtra 414001, India, Brae.",None,0
frame_00190.jpg,19.097807,74.738961,"mara, ee » f, feamien (a DOr, Sh oe, Dasbearare [*, La ., = ews, Ahmadnagar, Maharashtra, India, Shop No 01 Mg Road, Teli Khunt Rd, Sarjepura City,, Ly Ahmadnagar, Maharashtra 414001, India",pothole: 1,1
frame_00191.jpg,19.09774,74.738967,"onfe aitargea, fedoifen, Ahmadnagar, MaharasnNtra, India, Shop No 1047 Mg Road, Teli Khunt Rd, Sarjepura, City, Anhmadnagar, Maharashtra 414001, India, praies «5s a re “APES eet oh “ a Sch : he, a Day ofav at oY am s¥",pothole: 1,1
frame_00192.jpg,19.09774,74.738967,"ool, gaee Ahmadnagar, Maharashtra, India, ‘ i Shop No 1047 Mg Road, Teli Khunt Rd, Sarjepura, City, Anmadnagar, Maharashtra 414001, India, h Lat 19.09774° Long 74.738967°, eta 3",pothole: 1,1
frame_00193.jpg,19.097672,74.73896,"(ay OTS, = f tsar. - oe 4 ar dy ae Sia, = Ahmadnagar, Maharashtra, India, Shop No 1047 Mg Road, Teli Khunt Rd, Sarjepura, img City, Ahmadnagar, Maharashtra 414001, India, umm Lat 19.097672° Long 74.73896°",None,0
frame_00194.jpg,19.097672,74.73896,"Ahmadnagar, Maharashtra, India gs, Shop No 1047 Mg Road, Teli Khunt Rd, Sarjepura r, City, Ahmadnagar, Maharashtra 414001, India",None,0
frame_00195.jpg,19.097598,74.738955,"bal\\, BURS & TRAVE|, ae Ieee, sede, Maharashtra, India, 2046, Beside Shree Ram Mandir, Teli Kunth,, Sarjepura City, Heq#e-7R, Maharashtra 414001, India",None,0
frame_00196.jpg,19.097523,74.738949,"Mi A ‘, teeny, Ahmadnagar, Maharashtra, India, 2046, Beside Shree Ram Mandir, Teli Kunth, Sarjepura, City, Anmadnagar, Maharashtra 414001, India",pothole: 2,2
frame_00197.jpg,19.097523,74.738949,"Ahmadnagar, Maharashtra, India, 2046, Beside Shree Ram Mandir, Teli Kunth, Sarjepura, City, Anmadnagar, Maharashtra 414001, India",None,0
frame_00198.jpg,19.097456,74.738948,"Ahmadnagar, Maharashtra, India See, Telikhunt, Mg Road, Opp. Mandhan Building, Opposite ee, Bombay Bakers, Sarjepura City, Anmadnagar, Maharashtra =, 414001, India Sea, Li pe + — - > a © a, + VAR eTE® 12 7 . im WANT ORAS -— © . a ee SSS)",None,0
frame_00199.jpg,19.097456,74.738948,"Ahmadnagar, Maharashtra, India, Telikhunt, Mg Road, Opp. Mandhan Building, Opposite, Bombay Bakers, Sarjepura City, Anmadnagar, Maharashtra, 414001, India","pothole: 1, cracks: 1",2
frame_00200.jpg,19.097456,74.738948,"Ahmadnagar, Maharashtra, India, Telikhunt, Mg Road, Opp. Mandhan Building, Opposite, rm. Bombay Bakers, Sarjepura City, Anhmadnagar, Maharashtra, ie Ae Ape 414001, India, be Riers ae Lat 19.097456° Long 74.738948°, Rae Gee}",None,0
frame_00201.jpg,19.097403,74.738957,"Ahmadnagar, Maharashtra, India ! a, Telikhunt, Mg Road, Opp. Mandhan Building, Opposite < ~~, Bombay Bakers, Sarjepura City, Anmadnagar, Maharashtra Ses. :, 414001, India WAS, itd ‘at",None,0
frame_00202.jpg,19.097337,74.738955,"He Celeb, OY NIE), Ahmadnagar, Maharashtra, India, Shop No 173/9, A/463, S No 776, Mg Road, Teli Khunt, Rd, Near Bata Showroom, Sarjepura City, Anhmadnagar,, Maharashtra 414001, India",None,0
frame_00203.jpg,19.097337,74.738955,"Ahmadnagar, Maharashtra, India, Shop No 173/9, A/463, S No 776, Mg Road, Teli Khunt, Rd, Near Bata Showroom, Sarjepura City, Anhmadnagar,, Maharashtra 414001, India",None,0
frame_00204.jpg,19.097263,74.738949,"Ahmadnagar, Maharashtra, India, Shop No 173/9, A/463, S No 776, Mg Road, Teli Khunt, Rd, Near Bata Showroom, Sarjepura City, Ahmadnagar,, Maharashtra 414001, India",None,0
frame_00205.jpg,19.096731,74.746985,"is wees Sif bis, ee “4 Ahmadnagar, Maharashtra, India |, re »- £ x» Spww+hmf, Nalegaon, Ahmadnagar, Maharashtra, a we 414001, India, ee ow aR Lat 19.096731° Long 74.746985°",None,0
frame_00206.jpg,19.096484,74.747196,"a s1 |i y, Sw yuy, ies i a 7, — ew) Jy J, Ahmadnagar, Maharashtra, India, 3pww+hp5, Ahmednagar - Aurangabad Rd, Near Sbi Chowk,, Nalegaon, Ahmadnagar, Maharashtra 414001, India",None,0
frame_00207.jpg,19.096307,74.747325,"Ry, “¢¢ Ahmadnagar, MaharasnNtra, India, a 4 ? F. ‘4-7, 1, Mukundnagar, Ahmadnagar, Maharashtra 414001,, “ed wea Titel, a: SS . \aaihr~ Lat 19.096307° Long 74.747325°",None,0
frame_00208.jpg,19.096008,74.747502,"hg , > Ahmadnagar, Maharasntra, India §, : » 1, Mukundnagar, Ahmadnagar, Maharashtra 414001, §, . j India, ae a. \o _ Lat 19.096008° Long 74.747502°",None,0
frame_00209.jpg,19.09578,74.747613,"ye *, “gp, Ahmadnagar, Maharashtra, India, fl Wests ~~ 2nd Floor, Bsnl Office Building, Sbi Chowk,, as ay, i. Vaan, g Nalegaon, Ahmadnagar, Maharashtra 4140071, India, Spree 'e Lat 19.09578° Long 74.747613°",None,0
frame_00210.jpg,19.095408,74.747757,"AN ANS, | fae Ce) Ahmadnagar, Maharashtra, India, A By) ok » 3pwx+52c, Washimbe - Pawar Vasti Rd, M.i.r.c, gg |, XLS re ar, ~ Ahmednagar, Ahmadnagar, Maharashtra 414001, India, tS : - oe Lat 19.095408° Long 74.747757°",None,0
frame_00211.jpg,19.09517,74.747827,"tt _ Ahmadnagar, Maharashtra, India, ; dy. . % a, * 3pwx+24r, Nalegaon, Ahmadnagar, Maharashtra WS, OS we ee 2) Lat 19.09517° Long 74.747827°, me SS “ *, ee ees eee eee SS, / Py f 7 } r =. 5 See",None,0
frame_00212.jpg,19.094767,74.747909,"peer, Ne, Ahmadnagar, Maharashtra, India, Gpo Road Sbi Chowk, College Area, Ahmadnagar,, Maharashtra 414001, India",None,0
frame_00213.jpg,19.094607,74.747946,"- ee, Z Ahmadnagar, Maharashtra, India | ~, _ Gpo Road Sbi Chowk, College Area, Ahmadnagar., Maharashtra 414001, India, *. Lat 19.094607° Long 74.747946°",None,0
frame_00214.jpg,19.094402,74.74799,"ANE iN Ht, "" Ahmadnagar, \ Maharashtra, India |, 2 3pvx+q4p, Jamkhed Rd, College Area, Abiodnagar,} iS, “4 Lat 19.094402° Long 74.74799°",None,0
frame_00215.jpg,19.094252,74.748024,"Sil}, Si A ‘i, J Ahmadnagar, MaharasnNtra, India |, | 1, Narayan Doho, College Area, Ahmadnagar., | Maharashtra 414001, India",None,0
frame_00216.jpg,19.094036,74.748078,"1, Narayan Doho, College Area, Herta,, ee Maharashtra 414001, India, & Lat 19.094036° Long 74.748078°, A M GMT",None,0
frame_00217.jpg,19.093849,74.748123,"is We Ahmadnagar, Maharashtra, India, eet 2B «266, Narayan Doho, M.i.r.c Ahmednagar,, ae at or , a’ Ahmadnagar, Maharashtra 414002, India, ess . = Lat 19.093849° Long 74.748123°",None,0
frame_00218.jpg,19.093499,74.748166,"ae Treva, Ahmadnagar, Maharashtra, India, “—, 266, Narayan Doho, M.i.r.c Ahmednagar,, >, Ahmadnagar, Maharashtra 414002, India",None,0
frame_00219.jpg,19.093239,74.74815,"Ahmadnagar, MaharasnNtra, India |, 266, Narayan Doho, M.i.r.c Ahmednagar,, » Ahmadnagar, Maharashtra 414002, India, ™ Lat 19.093239° Long 74.74815°, ] ie ; “ay | > s - ad . “ > ‘ aN » SL ae te",None,0
frame_00220.jpg,Not found,Not found,"Ahmadnagar, Maharashtra, India | =, 1, Mahavir Chowk, Ahmadnagar, Maharashtra ie es, 423107, India",None,0
frame_00221.jpg,19.092797,74.747719,"Ahmadnagar, Maharashtra, India -, m 1, Mahavir Chowk, Ahmadnagar, Maharashtra, ® 423107, India, \ » J ’ yas . \ . 4, iy \ a PF , ) - .",None,0
frame_00222.jpg,19.092632,74.747309,"Sim 7, Ahmadnagar, Maharashtra, India, oo. ei «6 Chandni Chowk, 3pvw+3v9, M.i.r.c Ahmednagar,, yy ep APS — Ahmadnagar, Maharashtra 414001, India, Fic ae 7 25-89 Lat 19.092632° Long 74.747309°, PRS Ne tN",None,0
frame_00223.jpg,19.092499,74.747019,"(on,, a ae, = lh., mm 2, | ar on, si., be . a , nd os 4. =, 3) < > ee, 1. . Pr., wg?, Ae oogle, Ahmadnagar, Maharashtra, India, Beed - Ahilyanagar - Pune Rd, M.i.r.c Ahmednagar,, Ahmadnagar, Maharashtra 414001, India",None,0
frame_00224.jpg,19.092322,74.74659,"Ahmadnagar, Maharashtra, India | “3%, 48, College Area, Ahmadnagar, Maharashtra, 414110, India, & oe. AT TSE EZR PSE ¥ VOT SS",None,0
frame_00225.jpg,19.092187,74.746265,"Ahmadnagar, MaharasnNtra, India, 47, College Area, Ahmadnagar, Maharashtra 414110,, India Ot, | Lat 19.092187° Long 74.746265° Sei San",None,0
frame_00226.jpg,19.092017,74.74583,"we wy, _ dele 7, & _ye |) eae, Maharashtra, India, im \., i i x, in Oe, . — hen ad, AWA, 47, College Area, Heda, Maharashtra 414110, SS, tome ag ty ~ Lat 19.092017° Long 74.74583° =e, . Sea aon, eet *",None,0
frame_00227.jpg,19.091888,74.745528,"Ahmadnagar, Maharashtra, India, 3prw+r48, College Area, Ahmadnagar, Maharashtra, 414001, India",None,0
frame_00228.jpg,19.091739,74.7452,"a 3 ie tn f a ., * 2 ae) Ahmadnagar, Maharashtra, India, oP BS et) 3prw+r48, College Area, Ahmadnagar, Maharashtra =, ge 7 414001, India os, eee! ji) Lat 19.091739° Long 74.7452°",None,0
frame_00229.jpg,19.091639,74.744967,"ag 2 noe, 27° (> Se-2\| ede, Maharashtra, India, , he eo” > ak Nagar, Ahilyanagar - Solapur Rd, College Area,, eg - ‘6 od ». Hee, Maharashtra 414001, India, 5 SER BE Lat 19.091639° Long 74.744967°",None,0
frame_00230.jpg,19.091482,74.744617,"viVAVAVAVAV, VAVAVAYATA! Wi i ‘ a., nail, are, Lg Poy, Ws 7, by rer Hane | RPE, ris wn} i og iia i, ‘ e's, oN i, Ahmadnagar, Maharashtra, India |~, 3prv+hvq, Ahilya Nagar Flyover, College Area,, Ahmadnagar, Maharashtra 414001, India",None,0
frame_00231.jpg,19.09137,74.744349,"ry , ae, ae F a -, ‘ Ar. wh, Heated, Maharashtra, India, Ahilya Nagar Flyover, Seer, Maharashtra 414001, ee, India SS, WALES Sony ET ED, NER, wees",None,0
frame_00232.jpg,19.091209,74.743953,"yt —— aT * mt, se —S*, a AoE > ’, a ty. . Ne, Ahmadnagar, Maharashtra, India “3., 3prv+9hf, Mh Sh 142, Bhavani Nagar, Ahmadnagar,, Maharashtra 414001, India",None,0
frame_00233.jpg,19.091092,74.743679,". a Om ., “tees SRS Ahmadnagar, Maharashtra, India | =, a 2, ‘ Z oy 6/1, Daund Ahmednagar Rd, Market Yard Area,, : Fs Pot ote } Ahmadnagar, Maharashtra 414001, India, b/s ns Lat 19.091092° Long 74.743679°",None,0
frame_00234.jpg,19.090705,74.742786,"Ahmadnagar, Maharashtra, India, 3prv+644, Ahmadnagar, Maharashtra 414001, India",None,0
frame_00235.jpg,19.090705,74.742786,"Se | Ahmadnagar, Maharashtra, India, oe ee 3prv+644, Ahmadnagar, Maharashtra 414001, India |, ere E , Lat 19.090705° Long 74.742786° 5, WBaiEnd SQeudl™,",None,0
frame_00236.jpg,19.090636,74.74263,"Ahmadnagar, Maharashtra, India, 3prv+644, Ahmadnagar, Maharashtra 414001, India",None,0
frame_00237.jpg,19.090572,74.742484,"a Ley, ic ee, rr F ie > te =, we PJ i, a, {uu (Ue, Ahmadnagar, Maharashtra, India, Jai Anand Travels Bus Stand, Maliwada,, Ahmadnagar, Maharashtra 414001, India",None,0
frame_00238.jpg,19.090508,74.742348,"pat, , — 2 a’ on *, Googles, 2 TE ee ee, Heed, Maharashtra, India, Basement Of Patil Hospital, Kothi, Hea,, Maharashtra 414001, India",None,0
frame_00239.jpg,19.090435,74.742206,"en U7 ee at a, a —— 6 fies =, ' ioe, Aeite ues Glens, PP yo oe tA, aeqeat, Maharashtra, India, Basement Of Patil Hospital, Kothi, Se4¢-7Te,, Maharashtra 414001, India",None,0
frame_00240.jpg,19.090435,74.742206,"ede, Maharashtra, India, Basement Of Patil Hospital, Kothi, He4aaT1,, Maharashtra 414001, India",None,0
frame_00241.jpg,19.090349,74.742064,"SHeACATS, Maharashtra, India, Basement Of Patil Hospital, Kothi, Het,, Maharashtra 414001, India",None,0
frame_00242.jpg,19.090025,74.741576,"a Si ee --*“~ Ahmadnagar, Maharashtra, nda, r™ a Wasant Talkiz Road, Maliwada, Ahmadnagar,, “eh ‘4 Maharashtra 414001, India, dee BEE Lat 19.090025° Long 74.741576° Res, . CN .@ sit mh ety = ; ' : - ; weak : “€",None,0
frame_00243.jpg,19.090025,74.741576,"Ahmadnagar, MaharasnNtra, India, Wasant Talkiz Road, Maliwada, Ahmadnagar,, Maharashtra 414001, India",None,0
frame_00244.jpg,19.08994,74.741444,"are. a pee Ahmadnagar, Maharashtra, India, ""~ 4 se | Wasant Talkiz Road, Maliwada, Ahmadnagar,, = oo 42%0 | Maharashtra 414001, India, 0 ee ree Lat 19.08994° Long 74.741444° ~, oe ti ai* yj fal =p } : , : ts Ne",None,0
frame_00245.jpg,19.089852,74.74132,"6 , bs * -, > Pe ore,, Saw 7, a ®w “Yo ., a i), 1C88 Sy ag eH, SS Tk Pas 39 ax ¥ Brie, et iy, Dy, Ahmadnagar, Maharashtra, India, Wasant Talkiz Road, Maliwada, Ahmadnagar, a, Maharashtra 414001, India .",None,0
frame_00246.jpg,19.089757,74.741196,"ee ay | ie | Ahmadnagar, Maharashtra, India, a - ofa ii - Wasant Talkiz Road, Maliwada, Ahmadnagar,, epee eho"", Lat 19.089757° Long 74.741196°",None,0
frame_00247.jpg,19.089656,74.741065,"Ahmadnagar, Maharashtra, India, ; _ Ahilya Nagar Flyover, Bhavani Nagar, Ahmadnagar,, Maharashtra 414001, India <—",None,0
frame_00248.jpg,19.089656,74.741065,"Aber = Sree Ahmadnagar, Maharashtra, Tate lt, ‘Ts © Ahilya Nagar Flyover, Bhavani Nagar, Ahmadnagar, a + i Maharashtra 414001, India",None,0
frame_00249.jpg,19.089555,74.740934,"PD,, ih i Dp pay 7, : Ste *.«, Ahmadnagar, Maharashtra, India |, aan © i | Ahilya Nagar Flyover, Bhavani Nagar, Anmadnagar, [S —, 4 PP) Maharashtra 414001, India —s, TTS he a gp) Lat 19.089555° Long 74.740934°, as |b, ZOOG, Cisne. hits. ¥",None,0
frame_00250.jpg,19.089445,74.740794,"ia ’ a Py, Tt) i,, 4 A ey Te., a re, i = wf ks, >= r <> ary Bt ‘, - Ahmadnagar, Maharashtra, India, 3pqr+j63 Ymca Ground, Bhavani Nagar,, Ahmadnagar, Maharashtra 414001, India, a a G",None,0
frame_00251.jpg,19.089335,74.740652,"— Catatc, Ahmadnagar, Maharashtra, India, 3pqr+j63 Ymca Ground, Bhavani Nagar,, Ahmadnagar, Maharashtra 414001, India, rs . ', fe ©",None,0
frame_00252.jpg,19.089224,74.740511,"ae a Ahmadnagar, Maharashtra, India, ' a oe 3paqr+j63 Ymca Ground, Bhavani Nagar,, NM ag ape Ahmadnagar, Maharashtra 414001, India, ; iL FR} vem s ta Lat 19.089224° Long 74.740511°, an hs, ’ Sn a. . r ee, ¥ yi, ° - SS oN, ive as =, Ages, . SA eae a",None,0
frame_00253.jpg,19.089115,74.740371,"= eee a §=Ahmadnagar, Maharashtra, India| =, js re. “~- 3paqr+j63 Ymca Ground, Bhavani Nagar, SPR, cf Ya Ahmadnagar, Maharashtra 414001, India iy, “eV ae, fa PAS ins 7 ,, PDN Er ak",None,0
frame_00254.jpg,Not found,Not found,"Ahmadnagar, MaharasnNtra, India, 3pqr+j63 Ymca Ground, Bhavani Nagar,, Ahmadnagar, Maharashtra 414001, India, al, sh cm",None,0
frame_00255.jpg,19.089009,74.74024,"WU LUE BQ ithe Uy JETT ER a Le Be Sy “ Oe, Bit 4 ~Ahmadnagar, Maharashtra, India |, ae Fel 4 3pqr+p32, Mh Msh 2, Maliwada, Ahmadnagar,, — ts FENG: ug © Maharashtra 414001, India, . « ~-x~ Lat 19.089009° Long 74.74024°, Se a ae",None,0
frame_00256.jpg,19.088361,74.739416,"as Use ., _ eet Ahmadnagar, Maharashtra, India, ihe ne mg * ii i 39, Daund Ahmednagar Rd, Market Yard Area, HeAaatR,, rt 7 t 5 hes Pies Maharashtra 414001, India, Anmadnagar, Maharashtra, or \eRT § ss Pig, ‘txt Ke die PO 2 Us Lat 19.088361° Long 74.739416°, Pes a, on ae",None,0
frame_00257.jpg,19.088251,74.739275,"a a,, Bone son agee Maharashtra, India | Se, Market Yard, Opposite To Newaskar Petrol Pump, ,, Maliwada, Ahmadnagar. Maharashtra 414001, India",None,0
frame_00258.jpg,19.08814,74.739124,"tw . = fa, wotaese-* ~~ |) Ahmadnagar, Maharashtra, India |, 355, Daund Ahmednagar Rd, Market Yard Area, =, gj  Ahmadnagar, Maharashtra 414001, India, 2, Lat 19.08814° Long 74.739124°",None,0
frame_00259.jpg,19.088021,74.738978,"Ahmadnagar, MaharasnNtra, India, 3pqq+4jr, Bhavani Nagar, Ahmadnagar,, Maharashtra 414001, India oo",None,0
frame_00260.jpg,19.086887,74.737502,"(gars nage 2, eae ‘S.. “, ay. s, HeAeate, Maharashtra, India, Opp Addcc Bank, Shop No 136, Near State Bank, See, Maliwada, 3é4e47, Maharashtra 414001, India ene &",None,0
frame_00261.jpg,19.08678,74.73736,"Ahmadnagar, Maharashtra, India, Shop No, 12, Mh Sh 142, Near Vachnalay, Opp. Ambar Plaza,, Bhavani Nagar, Anhmadnagar, Maharashtra 414001, India, ake",None,0
frame_00262.jpg,19.086672,74.737218,"Ahmadnagar, MaharasnNtra, India, 29, Pune - Ahilyanagar Hwy, Nandanvan Colony,, Bhavani Nagar, Anmadnagar, Maharashtra 414110, India",None,0
frame_00263.jpg,19.085367,74.735507,"i M, OWT! ss \, REE, apie ) Ahmadnagar, Maharashtra, India, gle “a ' f F rv 44, Nh 61, Maniknagar, Anmadnagar, Maharashtra, er"" bw a ‘gu Lat 19.085367° Long 74.735507°",None,0
frame_00264.jpg,19.085268,74.735377,"Heqcat, Maharashtra, Tatelrs, 44, Nh 753f, Maniknagar, Hea4eat, Maharashtra, 414001, India, Y ox",None,0
frame_00265.jpg,19.085168,74.735245,"Ahmadnagar, MaharasNtra, India, 44, Station Road, Shivaji Chowk, Maniknagar,, Ahmadnagar, Maharashtra 414001, India",None,0
frame_00266.jpg,19.085061,74.735116,"th, ae, A\\Nuue = =, eet of, —s a, Ahmadnagar, Maharashtra, India |, 44, Station Road, Shivaji Chowk, Maniknagar,, Ahmadnagar, Maharashtra 414001, India",None,0
frame_00267.jpg,19.085061,74.735116,"\< Hat as, So 2, : af Ahmadnagar, Maharashtra, India, 44, Station Road, Shivaji Chowk, Maniknagar,, Ahmadnagar, Maharashtra 414001, India, nt Lat 19.085061° Long 74.735116°, WEN, Na As",None,0
